{
  "schema_id": "ctxvault.runtime-evidence-receipt/v0",
  "identity": {
    "receipt_id": "runtime_evidence_20260518_issue3_example",
    "created_at": "2026-05-18T14:35:00Z",
    "producer": {
      "name": "ctxgov.public-schema-fixture",
      "version": "0.6.2.post1"
    },
    "producer_schema_version": "ctxvault.runtime-evidence-receipt/v0"
  },
  "source_refs": [
    {
      "kind": "trace",
      "ref": "trace://example-local-run/trace-001",
      "digest": {
        "algorithm": "sha256",
        "value": "b14e7f3d7a5c1f26071b5ff55ea7bce15e9b16f39a784a9f4ed193b5f1c3a001"
      }
    },
    {
      "kind": "span",
      "ref": "span://example-local-run/span-validate-arguments",
      "digest": null
    },
    {
      "kind": "tool_call",
      "ref": "tool-call://example-local-run/call-003",
      "digest": null
    },
    {
      "kind": "artifact",
      "ref": "artifact://example-local-run/argument-validation-report",
      "digest": {
        "algorithm": "sha256",
        "value": "83f0a71db01e88a5a1a7cb9cd94dd3a652d1f9504e8ddf4ed3f946e0f9f9c002"
      }
    }
  ],
  "execution_context": {
    "runtime": "example-local-harness",
    "framework_version": "example-1.4.0",
    "config_fingerprint": "sha256:9d5fb37c8bbfe13b0bb2c16a9a64b0ce0bbf43f281fed6ef9d8ed5d3065a0003",
    "seed_fingerprint": null,
    "environment_label": "local-fixture-no-runtime-executed"
  },
  "outcome": {
    "status": "failed",
    "error_class": "ArgumentValidationError",
    "failure_stage": "tool_argument_validation",
    "observed_at": "2026-05-18T14:34:12Z",
    "failure_attribution": {
      "level": "stage_only",
      "statement": "The observed artifact supports that validation failed during tool argument validation; it does not attribute provider fault.",
      "source_ref": "artifact://example-local-run/argument-validation-report"
    }
  },
  "omissions": [
    {
      "state": "redacted",
      "source_ref": "output://example-local-run/model-output",
      "reason": "provider output body is not approved for public example use"
    },
    {
      "state": "omitted",
      "source_ref": "artifact://example-local-run/raw-terminal-capture",
      "reason": "raw terminal capture is unnecessary for this public schema fixture"
    },
    {
      "state": "unavailable",
      "source_ref": "span://example-local-run/provider-internal-span",
      "reason": "provider-internal trace span was not available to the producer"
    }
  ],
  "output_state": {
    "state": "observed_digest_only",
    "role": "assistant",
    "size_bytes": 742,
    "digest": {
      "algorithm": "sha256",
      "value": "a76a6d9c6a2ba12d8389c218ad9e82cf8f4d248f7f1bf45103f00a06ce1e0004"
    },
    "reason": "output existed, but only digest, role, and size are carried in the public fixture"
  },
  "rollback": {
    "rollback_ref": "rollback://example-local-run/delete-generated-report",
    "reversible": true,
    "path_available": true,
    "observed_state": "path_available_not_executed",
    "observed_at": null
  },
  "claims_not_made": [
    "trace_truth",
    "runtime_ownership",
    "provider_fault",
    "rollback_executed",
    "public_reliability",
    "compatibility_certification",
    "benchmark_result"
  ]
}
